{
  "schema_version": "career.resume_variant_review.v1",
  "policy_version": "resume_variant_review_v1",
  "core_version": "0.1.0",
  "authority": "assisted_non_authoritative",
  "baseline_resume": {
    "schema_version": "career.resume_input.v1",
    "text": "Morgan Lee\nSUMMARY\nProduct engineer building native apps.\nEXPERIENCE\nEngineer at Northstar Labs\nBuilt macOS workflows with Swift.\nSKILLS\nSwift, macOS, testing",
    "metadata": {
      "document_id": "synthetic-resume-phase7"
    }
  },
  "proposed_preview_text": "Morgan Lee\nSUMMARY\nProduct engineer building native Apple-platform apps with SwiftUI.\nEXPERIENCE\nEngineer at Northstar Labs\nBuilt native macOS workflows with Swift and SwiftUI.\nSKILLS\nSwift, macOS, testing",
  "changes": [
    {
      "change_id": "change-0001",
      "section": "summary",
      "start_line": 3,
      "end_line": 3,
      "original_text": "Product engineer building native apps.",
      "proposed_text": "Product engineer building native Apple-platform apps with SwiftUI.",
      "resume_evidence": [
        "Product engineer building native apps."
      ],
      "vacancy_evidence": [
        "product engineer",
        "SwiftUI"
      ]
    },
    {
      "change_id": "change-0002",
      "section": "experience",
      "start_line": 6,
      "end_line": 6,
      "original_text": "Built macOS workflows with Swift.",
      "proposed_text": "Built native macOS workflows with Swift and SwiftUI.",
      "resume_evidence": [
        "Built macOS workflows with Swift."
      ],
      "vacancy_evidence": [
        "SwiftUI",
        "macOS"
      ]
    }
  ],
  "discarded_changes": [],
  "warnings": [
    {
      "code": "assisted_content_non_authoritative",
      "message": "The proposed resume variant is externally assisted review content and is not authoritative for deterministic analysis or matching."
    },
    {
      "code": "evidence_occurrence_not_factual_certification",
      "message": "Exact evidence occurrence does not certify that generated wording is factually entailed; every selected change requires human verification."
    },
    {
      "code": "deterministic_baseline_preserved",
      "message": "The original resume remains the preserved deterministic baseline."
    }
  ]
}
